{
  "id": "rel-001-android-release-readiness",
  "title": "Preparar release Android",
  "objective": "Trocar identidade de exemplo, configurar assinatura e rede corretamente e validar um build de release instalavel.",
  "status": "backlog",
  "priority": "P2",
  "complexity": "complex",
  "plannerTier": "complex",
  "executorTier": "complex",
  "risk": "high",
  "baseCommit": null,
  "dependencies": ["sec-001-auth-privacy-hardening", "notif-001-idempotent-delivery"],
  "allowedPaths": ["mobile/android/", "mobile/pubspec.yaml", "mobile/README.md", "docs/"],
  "forbiddenActions": ["Nao versionar keystore ou senhas", "Nao publicar na loja", "Nao alterar Firebase externo sem autorizacao"],
  "acceptanceCriteria": ["applicationId definitivo aprovado", "Release nao usa chave debug", "Permissao de rede e configuracoes Firebase estao corretas", "APK/AAB release compila e e testado em aparelho"],
  "verification": ["cd mobile; flutter analyze", "cd mobile; flutter test", "cd mobile; flutter build appbundle --release", "Checklist manual em Android"],
  "worktreePath": "TBD",
  "notes": "Exige entradas humanas: identidade, keystore, conta e credenciais."
}

