{
  "id": "content-001-canonical-source",
  "title": "Definir fonte canonica de conteudo liturgico",
  "objective": "Eliminar precedencia ambigua entre bundle, cache, API, seed e CRUD administrativo, mantendo fallback offline e regras editoriais claras.",
  "status": "blocked",
  "priority": "P1",
  "complexity": "complex",
  "plannerTier": "complex",
  "executorTier": "complex",
  "risk": "high",
  "baseCommit": "12c868bea88313daa9a13d30d6952997abe5c4ee",
  "dependencies": ["ops-002-ci-quality-gates", "content-001a-liturgical-source-diagnostic"],
  "allowedPaths": ["docs/", "app/db/init_db.py", "app/services/devotional_service.py", "app/routes/devotional.py", "app/models/schemas.py", "mobile/assets/liturgy/", "mobile/lib/src/services/catalog_source.dart", "mobile/lib/src/services/bundled_gospel_catalogue.dart", "mobile/lib/src/services/api_client.dart", "mobile/test/", "tests/"],
  "forbiddenActions": ["Nao copiar texto biblico sem licenca", "Nao publicar conteudo sem revisao editorial", "Nao remover fallback offline sem substituto"],
  "acceptanceCriteria": ["Uma fonte canonica e precedencia estao documentadas", "Edicao administrativa tem efeito previsivel", "Bundle/cache/API nao divergem silenciosamente", "Licenca e revisao humana ficam como gates explicitos"],
  "verification": ["Revisao de arquitetura Sol low", "python -m pytest -q", "cd mobile; flutter test"],
  "worktreePath": "TBD",
  "notes": "O ADR diagnostico CONTENT-001A foi concluido e integrado. Esta implementacao permanece bloqueada ate decisao humana explicita entre API first, bundle offline first ou catalogo versionado hibrido, alem dos gates de licenciamento e revisao editorial."
}
